Article,Title
"Data analysis is the process of inspecting and exploring data generated by a particular population to find the information needed to make decisions and draw conclusions. With the use of data in decision making, most businesses today need data analysts. So, if you want to know about the best books to learn data analysis, this article is for you. In this article, I will introduce you to some of the best books to learn data analysis.",Best Books to Learn Data Analysis
"The performance of a machine learning algorithm on a particular dataset often depends on whether the features of the dataset satisfies the assumptions of that machine learning algorithm. Not all machine learning algorithms have assumptions that differentiate them from each other. So, in this article, I will take you through the assumptions of machine learning algorithms.",Assumptions of Machine Learning Algorithms
"You must have seen the news divided into categories when you go to a news website. Some of the popular categories that you'll see on almost any news website are tech, entertainment, and sports. If you want to know how to classify news categories using machine learning, this article is for you. In this article, I will walk you through the task of news classification with machine learning using Python.",News Classification with Machine Learning
"When there are only two classes in a classification problem, this is the problem of binary classification, just like that, classification with more than two classes is called multiclass classification. If you want to know the best machine learning algorithms for multiclass classification, this article is for you. In this article, I will introduce you to some of the best multiclass classification algorithms in machine learning.",Multiclass Classification Algorithms in Machine Learning
"The Multinomial Naive Bayes is one of the variants of the Naive Bayes algorithm in machine learning. It is very useful when the data is distributed in a multinomial way. This algorithm is especially preferred in classification tasks based on natural language processing. Spam detection is one of the applications where this algorithm can be used. If you have never used the Multinomial Naive Bayes algorithm before, this article is for you. In this article, I will take you through an introduction to the Multinomial Naive Bayes algorithm in machine learning and its implementation using Python.",Multinomial Naive Bayes in Machine Learning
"You must have seen the news divided into categories when you go to a news website. Some of the popular categories that you'll see on almost any news website are tech, entertainment, and sports. If you want to know how to classify news categories using machine learning, this article is for you. In this article, I will walk you through the task of news classification with machine learning using Python.",News Classification with Machine Learning
"Natural language processing or NLP is a subfield of artificial intelligence where we build applications to interact with humans. One of the examples of NLP applications is a chatbot which is used by so many websites to solve some of the common issues people face when taking their services. So, if you are looking for some of the best books for learning NLP, this article is for you. In this article, I will introduce you to the best books for learning NLP.",Best Books to Learn NLP
"By using a third-party application or API to manage the functionality of an application, you are automating the application. If you send messages, post photos or videos, or follow someone without opening your Instagram directly, that means you are automating Instagram. So, if you want to learn how to send Instagram messages automatically using Python, this article is for you. In this article, I will present a tutorial on how to send Instagram messages using Python.",Send Instagram Messages using Python
"Twitter is one of the most popular social media apps where people are free to share their opinions on any topic. There are so many tweets recorded about Pfizer vaccine awareness that can be used to analyze the sentiments of people about the Pfizer vaccine. So, if you want to learn how to use a Twitter dataset for sentiment analysis, this article is for you. In this article, I will walk you through the task of Pfizer vaccine sentiment analysis using Python.",Pfizer Vaccine Sentiment Analysis using Python
"The squid game is currently one of the most trending shows on NetFlix. It is so much trending that people who have never watched any web series before are also watching it. One of the reasons behind this is the reviews and opinions of viewers on social media. So if you want to learn how to analyze the sentiments of people about Squid Game, then this article is for you. In this article, I will take you through the task of Squid Game sentiment analysis using Python.",Squid Game Sentiment Analysis using Python
"Computer Vision is one of the fields of Artificial Intelligence that enables a computer to find meaningful information from digital images, videos and other visual sources of data. The Face ID found in iPhones is one of the best examples of the applications of computer vision. If you are looking for the best books to learn computer vision, this article is for you. In this article, I will take you through some of the best books to learn computer vision.",Best Books to Learn Computer Vision
"Python is one of the most popular programming languages today. It is preferred by data scientists and web developers and is currently used by companies like Google, Netflix, Facebook, Uber, Goldman Sachs, Paypal, and many more. There is a great demand for data science professionals today, and Python is one of the most important skills any data scientist should have. So, if you are looking for the best resources to learn Python, this article is for you. In this article, I'm going to introduce you to some of the best resources for learning the Python programming language.",Best Resources to Learn Python
"API stands for Application Programming Interface, it is a way to connect computers or computer programs. Simply put, you can think of it as software that helps in the development of other software. Many companies are looking for API developers today, so if you want to become an API developer, you need to educate yourself about API development. Python has many frameworks for building APIs, if you want to know about the best Python frameworks to build APIs, this article is for you. In this article, I will introduce you to the best Python frameworks to build APIs.",Best Python Frameworks to Build APIs
"A voice recorder is found in every smartphone and computer today. It is an application that is used to record sound and save it in a specific file format, which can be listened to and transferred to another device. If you want to know how to make a voice recorder using Python, this article is for you. In this article, I will walk you through how to make a voice recorder using Python.",Voice Recorder using Python
"Language detection is a natural language processing task where we need to identify the language of a text or document. Using machine learning for language detection was a difficult task a few years ago because there was not a lot of data on languages, but with the availability of data with ease, several powerful machine learning models are already available for language detection. So, if you want to learn how to train a machine learning model for language detection, then this article is for you. In this article, I will walk you through the task of language detection with machine learning using Python.",Language Detection with Machine Learning
"A Multilayer Perceptron or MLP is one of the simplest feed-forward neural networks. Multilayer Perceptrons are the types of neural networks which are bidirectional as they foreword propagation of the inputs and backward propagation of the weights. If you want to learn about Multiplayer Perceptron in machine learning, then this article is for you. In this article, I will take you through an introduction to Multilayer Perceptron and its implementation using Python.",Multilayer Perceptron in Machine Learning
"A neural network is a subset of machine learning that mimics the workings of a human brain while solving a complex problem based on deep learning. Neural networks are inspired by neurons found in the human brain. In this article, I'm going to introduce you to the types of neural networks you need to know as a Data Scientist.",Types of Neural Networks
"Clustering is the task of identifying similar instances based on similar features and assigning them to clusters based on similar instances. It sounds like classification where each insurance is also assigned to a group, but unlike classification, clustering is based on unsupervised learning. Here the dataset you deal with doesn?t have labels, so we cannot use a classification algorithm on a dataset without labels, this is where clustering algorithms comes in. If you want to learn all the clustering algorithms that you should know about as a data scientist, this article is for you. In this article, I will take you through an introduction to all clustering algorithms in machine learning.",Clustering Algorithms in Machine Learning
"Dictionaries are one of the most useful data structures in the Python programming language. A Python dictionary is used to store data in the form of key and value pairs. Most Python newbies get confused when iterating through a dictionary because the data is stored in key and value pairs. So if you want to learn how to use a for loop on the keys and values of a Python dictionary, this article is for you. In this article, I'll show you a tutorial on using a for loop on keys and values in a Python dictionary.",For Loop Over Keys and Values in a Python Dictionary
"Health Insurance is a type of insurance that covers medical expenses. A person who has taken a health insurance policy gets health insurance cover by paying a particular premium amount. There are a lot of factors that determine the premium of health insurance. So if you want to learn how we can use machine learning for predicting the premium of health insurance, then this article is for you. In this article, I will take you through the task of health insurance premium prediction with machine learning using Python.",Health Insurance Premium Prediction with Machine Learning
"The mean shift algorithm is a nonparametric clustering algorithm that does not require prior knowledge of the number of clusters. If you've never used the Mean Shift clustering algorithm, this article is for you. In this article, I'll take you through an introduction to Mean Shift clustering in Machine Learning and its implementation using Python.",Mean Shift Clustering in Machine Learning
"The BIRCH is a Clustering algorithm in machine learning. It stands for Balanced Reducing and Clustering using Hierarchies. In this article, I will take you through the concept of BIRCH Clustering in Machine Learning and its implementation using Python.",BIRCH Clustering in Machine Learning
"Agglomerative clustering is based on hierarchical clustering which is used to form a hierarchy of clusters. It is one of the types of clustering algorithms in machine learning. Unlike the K-Means and DBSCAN clustering algorithms, it is not very common but it is very efficient to form a hierarchy of clusters. If you've never used the agglomerative clustering algorithm before, this article is for you. In this article, I'll give you an introduction to agglomerative clustering in machine learning and its implementation using Python.",Agglomerative Clustering in Machine Learning
"DBSCAN stands for Density-Based Spatial Clustering for Applications with Noise. This is an unsupervised clustering algorithm that is used to find high-density base samples to extend the clusters. In this article, I will introduce you to DBSCAN clustering in Machine Learning using Python.",DBSCAN Clustering in Machine Learning
"The K-Means Clustering is a clustering algorithm capable of clustering an unlabeled dataset quickly and efficiently in just a very few iterations. In this article, I will take you through the K-Means clustering in machine learning using Python.",K-Means Clustering in Machine Learning
"A scatter plot is one of the most useful ways to analyze the relationship between two features. You must have used a scatter plot before if you are learning data science but have you ever tried to create an animated scatter plot using Python? If you want to learn how to visualize an animated scatter plot, this article is for you. In this article, I will take you through a tutorial on visualizing animated scatter plot using Python.",Animated Scatter Plot using Python
"Recently, we have seen an increase of more than 10 per cent in the stock price of Tata Motors. This has resulted in more attention to Tata Group stocks from all over India. But again today, we are witnessing a fall in the prices of Tata Motors' shares, which can be a negative signal for investors. So, if you want to learn how to analyze and predict the Tata Motors stock price, this article is for you. In this article, I will walk you through the task of Tata Motors stock price prediction with machine learning using Python.",Tata Motors Stock Price Prediction with Machine Learning
"Apple has just announced the date of its September event when it is about to launch the new iPhone 13. It is currently the centre of attention on the stock market. Stock market analysis is one of the popular applications of machine learning because we can predict stock prices using machine learning. So if you want to learn how to predict the stock prices of Apple with machine learning, this article is for you. In this article, I will walk you through the task of Apple stock price prediction with machine learning using Python.",Apple Stock Price Prediction with Machine Learning
"Deep learning is a subset of machine learning in which we use artificial neural networks to train models to solve complex problems where we need a large amount of data compared to other machine learning algorithms. If you want to become a machine learning engineer, you must learn deep learning. So, if you are looking for the best books for learning deep learning, this article is for you. In this article, I will introduce you to some of the best books to learn deep learning.",Best Books to Learn Deep Learning
"Many machine learning algorithms can be used to solve complex problems that require a large amount of data with a large number of features, but deep learning can outperform all algorithms. So to understand where we can use deep learning techniques, in this article, I will introduce you to the applications of deep learning.",Applications of Deep Learning
"Almost every app or website you visit today shows you what may interest you the most. For example, if you've been using YouTube for a long time, you must have seen content from your favourite creators or the type of videos you like to watch every time you visit YouTube. It is nothing more than a recommendation system. Recommendation systems are one of the most widely used applications in data science, and as a data scientist, you should know everything about recommender systems. In this article, I will therefore give you an introduction to recommendation systems in data science.",Introduction to Recommendation Systems
"There are so many algorithms in machine learning that you need to learn. Understanding the use cases of every machine learning algorithm is very difficult for every data science beginner, but it is very important as it helps you to choose the most suitable algorithm for your problem. So if you want to learn about the use cases of different machine learning algorithms, then this article is for you. In this article, I will take you through the use cases of some of the popular machine learning algorithms.",Use Cases of Different Machine Learning Algorithms
"In machine learning, the Naive Bayes algorithm is based on Bayes' theorem with na‹ve assumptions. This makes it easier to train a model by assuming that the features are independent of each other. In this article, I will give you an introduction to the Naive Bayes algorithm in Machine Learning and its implementation using Python.",Naive Bayes Algorithm in Machine Learning
"Swapping elements of a Python list is very similar to swapping values of the variables in Python. We use the index of the items to swap the position of the items, just like variables in Python. So if you want to learn how to swap the position of items in a Python list, this article is for you. In this article, I'll show you a tutorial on how to swap items in a Python list.",Swap Items of a Python List
